question,answer,id
"what is on the plate with jam , an apple , yogurt and orange juice",bread,44569
what is standing outside at night,bear,349907
what parked at the sea shore,boats,27777
what displayed in very beautiful vases in front brick wall,flowers,527139
what are standing in the zoo enclosure with trees,giraffes,504851
what are flying over the rock,kites,367952
what is flying in the air,airplane,395263
the kitchen with a metallic stove what,oven,349695
what topped with food next to a basket of bread,plate,306490
what is this girl happily filling with the healthy and creative food choices served at the buffet in this yard party,plate,487228
what does the woman eat at a street fair surrounded by people,dog,304584
the pretty young lady holding what,racquet,146162
what are people in uniform preparing on pans,pizzas,6640
what does the woman hold sitting at a round table with many people,glass,81971
what looks like an old fashioned one,train,435041
what is sitting on the dock,seagull,62927
what is rolling around in a field of grass,cat,577967
what illuminates the cats eyes,screen,82418
what are on display on the table,fruits,350510
what are sticking their heads under the stomach of another one,giraffes,252873
what is sitting in bathroom next to a sink,toilet,66859
what reflects the cupboards and refrigerator and other objects of a kitchen,window,75521
what stops in front of a group of trees,giraffe,241310
what is holding pink flowers in front of a window,vase,296464
what is laying on a bed,banana,26978
what is pulled over on the side of the road with a cat on the window,taxi,491728
what mounted over the black stove,oven,481828
what next to a cat in an entrance,sheep,206542
what is the yellow train pulling,cars,184654
the man wearing a blazer what holds a small bull horn,shorts,444583
what is standing still in the tall grass near a tree,zebra,323494
what sit on the tree with leaves surrounding them,oranges,151694
what stuffed with junk mail on the sidewalk,toilet,93519
what is walking all by itself outside by the wooded area,giraffe,368253
what holds his paw up to a television set,cat,119115
what is clean for customers to use,bathroom,13336
what parked on the tarmac,airplane,526506
what filled sandwich sitting next to a container of fries,meat,281168
what is the woman checking,device,333498
the large intersection with a bike what,lane,175751
what is the very old pontoon boat going down a tree lined,river,27921
"what covered in notepads , a laptop and other devices",desk,365879
what holds the baggie of cherries and bananas,bag,246328
what sits on the plate next to a serving of fries,sandwich,301614
what is carrying an atv and driving down the highway,truck,259638
what stacked up piled on top of each other,suitcases,145755
what sit vacant inside the building with slanted roof,toilet,329546
what is lying in the grass by a street,bull,484341
what is the person cutting on a board,broccoli,62344
what is parked among all of the many pairs of shoes,bicycle,136415
what is the woman leading from the stable,horse,120118
what does the green parrot eat,banana,562688
what is on the floor of the old building near debris,suitcase,226648
what snuggled on the bed with blankets,dogs,24762
what sits under some rags,bicycle,452162
"what , bowl of cereal and a plate with a banana and piece of bread sit atop a tray",cup,509654
what parked next to the yellow train,boat,40138
what set at standing height using various office furniture,desk,179983
what covered doughnuts with colorful sprinkles,chocolate,123336
what topped with lots of chocolate cup cakes,counter,86924
what parked in the road is red,motorcycle,347660
the little girl flying what in an open lush green field under a blue cloud filled sky,kite,387504
what is standing over by the rock,elephant,189542
what filled with furniture in front of a flat screen tv,room,449835
what graze on grass on a hill,horses,64520
what is attached to the laptop on the counter,tablet,37727
what are some men playing on a field,frisbee,56845
the woman wearing what holds a yellow bag,jacket,479944
what tub sitting next to the white toilet in a bathroom,bath,292818
what mounted up against the bathroom wall,urinals,44420
what filled with chiquita bananas in a store,shelf,490665
what sits on the roof with a view of a a city,pigeon,226872
what placed on the table and a headphone besides it,laptop,451826
the close up of a buses what,mirror,449573
what is wearing a black bandanna stands near a white counter and a window with plants in it,dog,92909
what does the man in a tuxedo gather from fellow partygoers,flowers,31590
what does the duck cross,road,129794
what is sitting next to a covered object,toilet,31912
the man riding what down a snow covered slope,snowboard,430205
what is laying on the bed and colored blanket,dog,548912
what is by someone 's feet on a shaggy rug,device,341226
what is standing outside in the bushes,giraffe,323804
what is the man holding,umbrella,369589
what is pulling cars along a railroad track,engine,213242
"what parked in the spot , in front of a meter",car,193166
older man using what,cellphone,239307
what does the little kid eat with her hands,pizza,273633
what is standing under an umbrella on the grass,dog,342408
what filled with pasta and broccoli on top of a table,bowl,7945
what sleeps on the pink bed in a clean house,cat,179965
what are there docked at this pier,boats,168665
what attached to the large pole inside a building,clock,63886
what several different types of mixers,shelf,79887
what are pictured grazing in a field,cows,73574
what is laying down next to the cat,dog,13636
what parked next to other trucks near a forest,truck,54614
what is sitting and staring next in the grass next to a small lamb that is sleeping,lamb,402191
what are on the kitchen counter near the stove,cups,122498
what is made up with matching blankets and pillows,bed,476585
what is nearby another elephant in its enclosure,elephant,34777
what is the man in a hat riding,skateboard,91154
what sit parked at an airport,jets,567430
the middle aged lady standing by the curb and holding what,umbrella,48670
what are standing a wide open field of grass and bushes,zebras,91264
the small boy wearing what is holding a frisbee,jacket,60415
what is the man eating with eggs,sandwich,172056
what are the group of people on the beach flying,kites,10281
what is parked and ready for customers,truck,159634
what is pulling cars down a stretch of track,engine,272081
what is standing by some thick trees,giraffe,362071
what is being repaired in the driveway,bicycle,417478
what flies into the cloudy sky,airplane,215502
what sits on the roof of the teddy bear maker store,bear,83454
the white plate topped with bacon wrapped what,dogs,296348
what is standing out in the field of grass,cow,324099
what are lined up on the desk,laptops,263769
what high in the sky with white trails,jets,340868
what did pieces of slice up sitting on top of a white plate,fruit,396193
what parked between two vehicles on a street,bus,466949
the bride and groom cutting what,cake,82990
what sits with the lid open in a bathroom,toilet,179735
what is walking through a lush green forest,bear,310748
what are laying down on the grass near a tree,zebras,202909
what is standing on the road next to some grass,zebra,135016
"dessert what with chocolate cake , strawberry , and ice cream",plate,352835
what is in the air,airplane,555911
what grazes under the large shade tree,zebra,428837
what is the girl in a pink shirt riding across an intersection,skateboard,14698
what sit inside the clear vase filled with water,roses,138342
what look out over the dry plain,zebras,119938
what are there cooking in an oven,dishes,489374
what shows it is 12:35,tower,481521
what are standing outside of a building,horses,131915
what is the semi truck pulling covered with tarps,bed,414106
what is placed on the chair in the kitchen,towel,197959
"what is full of chairs , tables and couches",room,236744
what is standing behind the fence in a field,cow,141695
what parked next to each other in front of a blue wall,scooters,244056
what opens up to an area with a toilet paper holder,door,140603
what is all white with marble contertops,kitchen,311895
what did grass roof on a bay with cliffs,umbrellas,380284
what is traveling down a road next to shrubbery and houses,truck,27942
what a large spool of metal,truck,164694
what shows the picture of a tennis team,photograph,543795
what hold three street signs displaying various messages,pole,266652
the woman holding what next to a statue of a catcher,bat,297877
what is the man showing his baby,giraffe,527181
what is parked near the curb on the waterway,boat,207959
what stand around in an enclosed area,giraffe,517045
what is standing in the open field,giraffe,228244
what laying down inside of an unzipped suitcase and looking up,car,89694
what is somebody serving into wine goblets,wine,441325
what leaned over eating grass by some rocks,giraffe,468670
what is the place setting with high backed,chairs,148809
what is crossing a forest lined street,bear,561468
what is on the table ready to be eaten,salad,286914
what does an elephant raise over its head,trunk,553267
what does the young man check while sitting in the park,phone,240321
what is lying on the black sofa in the dark,cat,559073
what is embellishing the market which sits beneath a clear blue sky,tower,362561
what displayed in the white box,vases,399162
what do the chrome gas tank and front fender dress up,motorcycle,379122
what is opened to show it is fully stocked with condiments and food,refrigerator,381008
what is driving down a snow covered street,bus,169026
what are pulling the carriage during a parade,horses,217165
what next to a concrete statue,cow,211810
what topped with the salad next to a glass of oj,plate,542472
what are facing in the opposite direction,giraffes,130252
what is seen in this image,bathroom,394100
what sits among bare trees and a rusty fire hydrant,building,186233
what are laid out on display with tomatoes and chicken,sandwiches,398799
what is in the fenced enclosure beside some trees,giraffe,226693
what hangs by the mirror in a bathroom,towel,318222
what is sitting in front of the big elephant,elephant,158899
what are the crowd of people flying next to a lake,kites,99004
what can be seen at the corner top of a brick building,bird,495134
"what is the drawing room with carpet , sofa.a center table with two laptops and a coffee mug.there",shelf,432522
what soar through the sky near a lighthouse,seagulls,278394
what is displayed beside the wire frame model,clock,59399
what are sleeping on the desk in front of a computer,cats,147952
the woman stands near a door and holds what,phone,352199
what is going through the city,bus,481251
what sits on the tracks at the train station,train,579699
what are in field near a valley,horses,96726
what is baby being spoon fed by his or her mother,fruit,238200
what parked in the lot across from buildings,buses,431376
what graze among the herd of antelope in a green field,zebras,457233
what are walking through tall grass and bushes,zebras,207097
what parked on the city street near a van,motorcycles,288310
what is shown without decor,bathroom,541332
the person riding what on top of a snow covered slope,skis,453781
"what is made with cheese , hotdogs , and a pickle slice",sandwich,187537
what is being held near the jet,flag,403170
what is next to the yellow construction truck,truck,31057
what is sitting on top of an airport tarmac,airliner,336690
what is sticking out of a building,tower,524144
what is being led by two horses and three men in red coats and top hats,carriage,163220
what sits in the bathroom,toilet,516080
what full of food inside,refrigerator,394595
what fo soup sitting on top of a wooden table,bowl,465302
what is the person holding up,picture,87554
what is walking around by some rocks,giraffe,575121
what held by the man is completely empty,glass,1994
what is on the sidewalk street,bear,438485
what is the man riding on the pavement,skateboard,292928
what filled with food but the shelves are practically empty,door,541856
what is in the stables getting care,horse,164698
what topped with the pizza on a table,plate,179812
what is game in the plastic package,remote,181489
what are sitting on the paper on a table,cars,353582
what is packed with many foods and drinks,fridge,443635
this bathroom is painted dar orange and has what,shower,418213
what stands ready on the runway,jet,76372
what served at table with rice and vegetable next to glass of wine,plate,426428
an elderly man cutting what as a woman watches,cake,469293
what stands near the wooden bench,cow,182032
what are parked on the side of the road surrounded by buildings,cars,368515
what is the woman cutting with a knife,cake,575055
what are interrupted by another species of quadraped,zebras,563155
what sits in front of a tower with a clock on it,lamp,51198
what is in the shape of a boat with masts,kite,189847
what is ready for take off,trains,216301
what stacked with distinctive sorts of things all around,picture,75810
what are grazing in the large grassy area,horses,210591
what is the man riding on a sidewalk,skateboard,35037
the woman on a train turns her head and looks out what,window,425590
the man riding what down a snow covered slope,skis,576399
the woman holding what up with food on it to a man,fork,352565
what are being prepared on the stove grill,pizzas,160013
what is this napping next to a shoe while wrapped in a blanket,puppy,72229
what is on the runway in the rain and some fog,airplane,474568
what stands under the tree near a fence,giraffe,457194
"what is stripe red , white , and blue",toothbrush,411931
what are being flown in the overcast sky,kites,361381
what sits on shelves of a desk,equipment,35423
what is parked by itself in a parking lot,motorcycle,328348
what is posted on top of a brick tower,clock,219906
what opens its mouth while standing on a beach,seagull,113708
what drawn carriage being drove on a cobblestone road,horse,174185
what does the man serve to two ladies at a restaurant,wine,166959
what is sitting on a growth of banana 's,bird,291665
what is the man using,laptop,291417
what is holding an umbrella and pointing with its finger,statue,159965
the person riding skis and a person riding what,snowboard,121172
what fly in the air above the water,kites,69018
what are two girls flying by the water,kite,41516
the texas professional baseball player holding up what,bat,344735
what topped with sliced up fruit,plate,90192
what is the woman sitting before a piece of cake with three lit,candles,53351
the person is wearing what and is in the snow,skis,244334
what is standing in the grove of trees,giraffe,350969
sliced what on the baking sheet with a mesh bottom,apples,572183
what are looking around at each other next to a rock,giraffes,285023
what is standing by the stop sign,glasses,107362
what made out of wooden boards,frame,120780
what topped with raspberries and small eggs,cake,510517
what offers many practical options,knife,244326
what sprouts from underneath the grey box,plant,22767
what do the passenger train,car,224812
"what stand next to each other , with a zebra standing in the background",giraffes,362247
what is sitting alone at the stop light at night time,car,274585
the beautiful young woman holding what,racquet,219674
what is on the plate ready to be eaten,sandwich,44763
what stands in the trees with her baby,giraffe,338215
what is the man milking into the mouths of cats,cow,343404
what is shaking the hand of a man holding a frisbee,dog,403720
five people holding a knife together and cutting what,cake,372685
what is sitting on the brick sidewalk,hydrant,84785
what go lose and are going up to cars,horses,218635
what is there standing alone on a field,giraffe,306277
what is attempting to complete the difficult trick,elephant,533519
the man wearing what hold a half full glass,tie,230752
what stand around the large dirt field,sheep,31678
what are there hanging by a bathroom sink,towels,451539
what filled with liquid on a counter with a hand touching it,blender,293030
what filled with flowers on top of a wooden table,vase,94518
what is walking down the city street,bull,84499
what is on the plate,sandwich,314979
what filled with pink flower next to a wall,vase,272211
what is shown with contact pictures lined across the top,cellphone,337325
"what are wearing saddles , grazing at the far end of a field",horses,67355
what does the fluffy cat stick in a coffee mug,paw,363933
what topped with multiple laptop computers and desktop monitors,desk,40304
what taken at sunset looking at big ben,picture,310660
what are laying next to a window sleeping,cats,397358
two little kids holding what 's on the mountain,ski,472429
what bear walking on the log in the woods,grizzly,309181
what did the white box of krispy kreme glaze,donuts,58041
what did small portion on table of restaurant,meal,180123
what is tug on the water near the bank,boat,579922
"what stand on dusty ground , looking out through an open slat fence , behind which rests hay bales and a high wall",horses,247641
what are sitting in their beds beside a window,cats,397358
what is the women serving at a social function,wine,447179
what is erected of a huge pair of scissors,sculpture,417089
what are walking together in the field,zebras,532124
"what are in front of a yellow staircase : a glass suitcase , a real suitcase , a suitcase-shaped concrete block , and a statue of a suitcase on its side",suitcases,531906
what is the man swinging,bat,481807
what filled with many oranges and bananas,wall,202326
what filled with unripe apples in an apple orchard,tree,149179
what stocked with all sorts of food,refrigerator,195317
the woman wearing what with a yellow oriental parasol opened over her head,sunglasses,7689
many people at a station board what,train,175238
what is shown grazing on some grass,zebra,30764
what placed under trees in the woods,bench,575918
what is the baseball pitcher with an orange shirt throwing,ball,449914
what does the woman feed from her hand,giraffe,355652
what shaped sink standing in front of a faucet and tiled counter top,bowl,186103
what are on the grassy area two girls playing,frisbee,149896
what parked in front of a helicopter next to a car,motorcycle,519145
what is displayed near the wall,clock,82735
what is shoved into the birthday cake,knife,251899
what stand in the shallow water on a beach,birds,518290
what poles standing on the snowy flat area,ski,149686
what are sitting next to each other in the grass,goats,335039
what is next to the rock bed with water running threw,bear,532941
what is woman on skies standing on snow covered,hill,295032
what enclosure containing giraffes and ostriches in the same exhibit,zoo,259446
what is prepared and ready to be eaten,meal,37210
what does the passenger train travel along beside the seashore,tracks,510243
what is parked indoors at the motorcycle show,motorcycle,62707
what is sailing the large body of water,boat,480666
what are there left out on the table,phones,445540
what is walking along the beach in the water,seagull,115291
what does the horse eat in a dry field next to a small dog also smelling or eating the grass,grass,370157
what is the old man eating at a restaurant,cake,391747
what is filled with all the toppings,pizza,539915
what are flying in the air on a cloudy day,kites,157815
what parked next to the grass and a bag is attached to one of them,motorcycles,573875
two people leading what next to a fence lined with people,horse,571311
what is laying on top of a laptop computer,cat,68136
what is sitting in the grass by a tree,bird,567957
"what a bluetooth , and another electronic device on a table",cellphone,554744
what is holding the variety of foods,tray,258517
vintage what with metal handle and decals,refrigerator,86797
what perched on the back of a chair,bird,250593
what is playing with the yellow frisbee,dog,564483
what parked in the garage next to a tall building,bus,270475
what is mounted on the pole for public display,clock,194262
what is part of the beauty of a mountain scene,horse,427800
what are lined up on the wooden wall,skateboards,233873
what is standing by the fallen tree,zebra,321355
what stopped on the side of a street with some pedestrians,bus,466775
what is sitting in the middle of a park,tower,499460
what is panting in the woods next to a water bottle,dog,59741
what displays several cupcakes with yellow icing,tray,37620
what sits in front of the shore at the beach,bench,459475
what sits at the runway gate waiting to be loaded,airplane,115638
what is looking out the window at a bird,cat,569975
what is parked for display on this lawn,boat,503074
what is sitting on the limb of a tree,bird,529902
what do people fly next to a banner in a city,kites,77834
paved what with several cars moving past an exit,highway,57068
what topped with the fruit and veggie salad,plate,553039
what is traveling down the track in the middle of an arid plain,train,45543
what are driving down the street,buses,561354
the brown bed frame what a black sheet and some drawers,window,34277
what is sitting next to the shoe,cat,451515
what filled with people,bus,440390
the man or woman crossing what,road,337445
what are lined up against the door,skateboards,520843
what is there sitting in an empty lawn,chair,487930
what is being tied on the pose with pink ribbon,bear,348573
what stands in front of many other vehicles on the grass,motorcycle,11426
the person riding what down a snow covered slope,skis,45351
what parked next to the building,bus,162996
what opened to show it 's almost empty contents,refrigerator,74082
what are pulling the man sitting in a cart,horses,301187
what is anchored but sitting on the water,boat,423943
what tied to the lamp post on a sidewalk,dogs,113880
what are packed in the trunk of a car,bags,505927
what next to a wire fence,zebra,437714
what parked by the hydrant with hoses connected to it,truck,347878
what are soaring through the air,kites,278799
what is tour making a turn onto a road,bus,240952
what filled with apples oranges and other fruits,shelf,198375
what is in the sky,airplane,498813
what is the man putting together,kite,5312
the man wearing what holds a colorful kite,hat,283728
what is the cowboy putting a sadle on a brown and white spotted,horse,408328
what is eating grass in a verdant pasture,cow,115522
two people wearing what standing at the edge of a snow covered hill,skis,495171
what fastened to the side of building,clock,20281
what is the cat watching intensely,bird,236941
what eats grass on the side of a hill,cow,525633
what is looking out at the tall building with a clock on the face,window,180079
what filled with some tables and shelves,kitchen,457732
the man riding what down a snow covered slope,skis,381664
what is the boy riding in a skate park,skateboard,519625
what propped up a against the rock,phone,170999
what is parked in the street,car,222489
what perched on the tree limb with its beak open,bird,74390
what are being flown by people in dresses and robes,kites,474979
what is driving down a road is blue and white,bus,408506
what did the group of people cut shaped like a dinosaur,cake,112992
what is filled with people wearing life jackets holding paddles,boat,501493
what sits on the bathroom floor next to some laundry,cat,72704
what are walking towards and entrance to the building,zebras,530888
what is laying on the table,hat,541226
what is the street sign sitting next to a lush leaf filled,tree,557263
what is the large semi truck driving past a fog covered,hillside,500317
what are placed on the outside of a window,bear,344883
what is in the small steel cage,giraffe,542602
the man wearing what stands in front of a urinal,backpack,47684
the black and gray cat what a plant and some buildings,bicycle,484661
what are parked in an open field,trucks,224753
what moved away from its normal position in the kitchen,refrigerator,515843
what sits perched on atop of the bed peering forward,cat,527979
what a white boat behind it next to a street light,vehicle,228519
what show fruit and vegetables in them,bowl,322411
what held by hands over foil wrap,sandwich,215863
what strapped to the cross bar of a bicycle,umbrella,18766
the person wearing what walks across the snow towards the woods,skis,211161
the male wearing what is playing tennis,shirt,463758
what is standing all alone looking at the woman,giraffe,563028
what is parked in the field,engine,55642
what is the man walking along while carrying a surfboard,beach,371939
what is the man holding,laptop,300399
what filled with furniture with a table in the center,room,432286
what are pulling the cart full of things,horses,401812
what holding a pizza with olives and cheese,tray,531308
what topped with french toast with sliced bananas and walnuts,plate,504160
what are laying on the bed in a bit of sunlight,cats,141240
the black and white photo of women with sports what,equipment,456987
what are two little kids helping make,pizzas,569774
what protrudes from the side of a building,clock,203827
what is clean and free of clutter,kitchen,407289
what are people standing in the rain are holding,umbrellas,261585
what pulls the man in a wagon down a city street,horse,202004
what propped up on an egg crate,phone,177924
what did chocolate and sprinkle on the plate,donuts,14759
"what depicts the commode , free-standing sink and bathtub with colorful shower curtain",scene,554040
what are eating leaves on a pole,giraffes,96586
what make their way down a hill into a reservoir,elephants,370986
what sits parked on some ply wood,bicycle,268306
what walks in the dry field area,elephant,216817
what are driving down the street,buses,454821
what is there painted new zealand airplane,zebra,487413
what drive by the couple of road signs,cars,89203
what train that is traveling down railroad tracks,cargo,528699
what plain with mountains in the distance and several sheep is standing together,grass,6336
