question,answer,id
what is the man with a hat riding,bicycle,61982
what hang in the square from the ceiling,clocks,533004
what carries hay over a bridge,truck,528112
what cut and displayed on the platter,fruits,302885
what parked on the street,buses,105363
what is sitting in a bathroom next to a plant filled with waste,toilet,567813
the man sipping what looks at the corn covered hotdogs in front of him,drink,523495
what docked in the harbor next to shore,boat,489267
what did a cut up sitting by a plate and a pair of cups,pizza,556360
what is the large commercial airplane flying,skies,167856
what equipped with the large box for pizza deliveries,motorcycle,309781
what is ready to make the delivery,truck,500525
what speeds down the tracks through the country side,train,27504
the girl wearing what covered donuts,glasses,515673
what embedded with flowers,cake,520501
what is parked outside of the fenced in cemetery,motorcycle,272940
what is sitting on the table on the floor,vase,462974
what is laying on the bed,cat,494504
what is stopped at the red light,car,280187
what filled with cake and pastries in a store,shelves,16254
what sits in an open takeaway box,pizza,542642
what are standing in the shallow water,birds,462925
what pulls up next to cars with another bus behind,bus,406933
what lay near their mothers and have yellow tags in their ears,lambs,29712
what is in the field of grass eating leaves off a tree,giraffe,159542
what is topped with the handful of fresh herbs,pizza,270195
what is next to the yellow curb,hydrant,103564
what is some people under red umbrellas and one male wearing,shirt,38226
what filled with colorful kites,sky,452938
what stand with various sandwiches and desserts on it,tray,15944
what is on the table near the large window,laptop,566491
what is laying on a wooden floor holding a stuffed teddy bear,dog,580525
what graze for food side by side,zebras,491914
three young men jumping what off a ledge,skateboards,491426
what is in the little nook of its own,toilet,330136
what docked with the sign that reads jommu,boat,280160
what are there parked a brick surface,trucks,369156
what is standing in the field,giraffe,516843
what is served on top of a plate,entree,412680
what are on each side of the hallway with two white dresses that are on a mannequins that are behind them with pairs of umbrellas on each side going back in the hallway,umbrellas,385752
what decorated with fine wood paneling,bathroom,161809
what is shining while many people snowboard on the slope,sun,84884
"what filled with milk , condiments and other things",refrigerator,118234
what is there next to a busy road,tower,462404
what next to a frisbee,dog,5355
the guy wearing what is swinging a bat and is standing in a batters box inside of a wire fence,helmet,36341
what are parked inside of the workshop building,motorcycles,485473
"what are shown on the dark street , very difficult to make out any detail",cars,128503
what taken behind the bus on the road,picture,576239
baseball player and pinstripe uniform holding what,bat,544240
what did red bricked with white trim and large clock,building,486941
the young lady standing on wet ground holding what,umbrella,349466
two children eating what together and dressed up in costume clothing,pizza,552354
what sits on the shelf in a room,laptop,496977
the bed a guitar what a window and pillows,cabinet,55527
what are there parked in front of a double decker bus,bicycles,25833
what are walking on some grass in their pen,zebras,532819
what is full of white and brown teddy bears,box,351397
what runs through an empty living room,dog,304523
what uses its trunk to grasp a tree branch,elephant,543354
what shows various types of drinks,fridge,280508
the man wearing what is eating a banana,hat,178222
what does the helmeted baseball batter hold up,bat,481866
what is the person wearing levi jeans is holding,toothbrush,414738
what does the pitcher throw during a baseball game,ball,463533
what walk next to each other in front of the water,elephants,260336
what is the boy with a fork eating,cake,189183
what hooked up to the fire hydrant on a street corner,truck,359695
"what is sitting on a beg , with a horse stitched on it",bag,497600
what is parked at the curb near the bicycles,motorcycle,490887
what parked in the waterway and some people,boats,363160
what stands by the fence as it eats some bright green grass,zebra,231222
"what covered with green onions and sesame seeds , broccoli on the side",fish,373704
what sits on tarmac as it is being serviced,jet,272846
what is the man with a hat holding,frisbee,26905
what stand next to the fence in a field,horses,406196
what sits in front of a pond,bench,282349
what is the player in a baseball game holding,bat,297173
what are sitting on a ledge,birds,444893
what is the train coming down approaching a curve,track,543000
what is stopped at the train station,train,201278
what lays on the keyboard of a laptop,cat,178798
what topped with the cut in half banana next to two forks,counter,528756
what did the red and yellow fire hydrant on a green grass cover,hillside,79696
what flies above the trees and through the air,eagle,366473
what made out of skis sitting in the grass,chair,75359
what is standing on the hill in the mountains,horse,395140
smooth what with exhaust fan that has light turned on,stove,89
the red and black train leaving what,station,444367
"what stands under the mirror and light fixture , with a towel hanging nearby",bowl,100863
what does man pull by rein through the water,horse,14357
what mounted on the side of a building,clock,7361
what is drinking from the toilet,cat,286720
what does the woman open,oven,243304
what filled with fruit and nuts,bowl,387527
what lays its head on a computer keyboard,cat,420344
what parked in the city parking lot next to a car,motorcycle,96557
what are sitting on the wooden desk in a room,laptops,461042
what does the captive elephant eat ; the elephant is guided by a person on the ground,grass,495753
what are walking around a circus ring with a trainer,elephants,258690
what do the group of snowboarders prepare in the snow,gear,497610
what is sitting next to a lap and a laptop,tv,284867
what is shown in dim lighting,kitchen,265161
what made in the cereal bowl,salad,53091
what is the man feeding from his backyard,elephant,201342
"what stand on the grassy area , near some rocks",giraffes,27352
what is living room,apartment,372482
what did the clear vase with long stem on a dining table,flowers,532595
what is the woman with red hair wearing a uniform eats,dog,60035
what are being prepared to serve on the wooden cutting board,pizzas,125597
the black car is near someone riding what,bicycle,28231
what is sitting on a table,sculpture,21698
what is sitting on a mug,banana,326849
what are the catcher and an umpire behind a boy wearing a red shirt and holding,bat,527291
what waits for the frisbee to be thrown,dog,206469
what are laying on the wood floor by a window,sinks,203143
there is a young woman playing what with a dog,frisbee,71313
what are sitting on the curb in the sun,suitcases,79355
what is the baseball player on a field throwing,ball,569511
what do the pedestrians walk down next to the large landmark,sidewalk,370945
what is the person holding tied together,remotes,60980
the man touches what,truck,152293
what are climbing over the huge rocks,goats,293379
what is open on the table,phone,190839
what are moving against each other on the road,vehicles,146656
what are there pulling up to this stop,buses,266557
what parked on rough road in dry terrain,vehicle,237262
fresh what on the plate topped with a brown sauce,vegetables,498860
what stand in the sloped field of grass,horses,439874
what stand in the foreground with trees in the background,giraffes,114815
what are place next to each other on display,pizzas,549897
the man wearing what stands in front of a plant,hat,16142
what topped with the cheesy burger and a pile of fries,plate,299190
what did the building with two park sitting outside,cars,60362
what are on plates near a glass of soda,pizzas,394269
what filled with furniture and a dinning room table,room,272882
the child and dog wearing what,hats,301273
what is sitting on top of a counter,cake,536902
what is reaching his head through the fence,giraffe,165034
what is parked in the parking space on a busy city street,motorcycle,288310
what are arranged and on display,umbrellas,238563
what is flying through the air in clear sky,airliner,433561
what does the baseball player swing,bat,272538
what is coming into the station where people are waiting,train,517455
what holding a piece of tree,bear,436411
what is looking in someone 's bag for something,cat,202548
what are the party goers enjoying on the table,wine,92696
what are two women and a male in a blue shirt making,donuts,301431
old fashioned photograph depicting what moving through rail yard,locomotive,101602
what are seen grazing in a field,horses,537390
what is set up in front of another powered-on one,computer,363464
what cabins along the railway,cargo,29403
what does the young boy hold,bat,380425
what holding several different color toothbrushes in front of blue tile,container,249348
what is perched in the tree with leaves,bird,129719
what are laid out for cider tasting,apples,109858
what is on the plate cut in half,banana,144495
what stand where people are shopping and buying,fruit,233697
what walks on the rocks near some brush,goat,338850
what did the group of people on a horse pull,carriage,461086
what is on the trailer bed in a driveway,clock,359132
what is the man cutting,cake,92916
what are lined up next to each other,surfboards,419908
what does the zebra eat in front of some palm trees,grass,581223
what topped with slices of pizza,plate,213070
what does the man drive over the field,horses,272036
what is driving down the street,car,42529
"what complete with the toilet , sink and bath tub",scene,47434
what are looking at each other while sitting on a tree branch,birds,44603
what is the man driving,engine,57018
what plays with his friends bike too,bicycle,146324
what sits empty by the field,boat,315324
what stands in the field with the sea in the distance,horse,166137
what are two zebras standing in the woods bu staring,trees,490893
what are facing opposite directions parked side by side,buses,301158
what is snuggling near his mother,elephant,60170
some pink tile a sink what a mirror and window,toilet,293371
what filled with the mixture on top of a counter,blender,509792
what is parked in front of a home in the shade,truck,266136
what topped with meat and broccoli,plate,229976
what is by the lamp,bear,114694
what is traveling down tracks next to a building,train,364201
what is bending down looking through a wire fence,giraffe,277352
what pulling out of frame by a hand,suitcase,528960
what is on the grass with two people,horse,11065
what a dog in a rearview mirror,camera,403360
what are walking in the dirt in their cage out side,zebras,262393
what is surrounded by display cases,sculpture,139240
what is setting on the stove,pizza,420461
what is standing next to the water looking at it,horse,176131
what topped with lawn chairs and umbrella,beach,308349
what is standing on the grassy field,goat,54071
what is set up for the good night,bedroom,567145
what large window gives a great view of a city,bathroom,250827
what is the woman jumping over a piece of wood,horse,99548
what stacked together on the table,cups,295057
what grazing some grass next to some picnic benches,horse,361842
"what features full bookcase , a laptop and a red leather chair",office,241675
what are parked in the bright blue watered marina,boats,345944
what is cathing the frisbee a woman is holding an orange frisbee in hand,dog,540135
what do the woman with a black polka dot walking down a street,umbrella,564431
what is laying on the bed next to pillows,dog,276516
what noticed that it is being watched,bear,223573
the woman wearing what is surfing in the ocean,suit,89095
what next to a white and green trimmed building,giraffe,434665
what generated animated woman is playing tennis,computer,86526
what topped with noodles and vegetables,plate,119525
what walk across an open tundra,bears,156216
what is coming down the track with sheep in the way,train,430495
what is in the center of semi-circle window,clock,35303
what are sitting in the box,donuts,177148
what next to a bigger one,elephant,281121
what filled with passengers in a body of water,boat,557308
"what is somebody eating with meat , tomatoes , and lettuce",sandwich,463696
the tennis player wearing what is swinging a racket,cap,171607
what cut in half with cheese and other ingredients on top,pizza,193168
what does the boat sit in the water in front of a brick,house,439053
what is the person riding at a demonstration,horse,256290
what decorates the front of the chicago board of trade building,clock,220086
"what is the train slowly arriving ,",station,240407
the bridge and groom cutting what,cake,319201
what holding aback coffee cup and a mouse,desk,434053
what are standing together next to each other in a large field,cows,198682
what are the four men riding by side,side,403567
what is preparing for take off on runway,airplane,154972
what enjoy playing on the bed,cats,81639
what sits on the bed in a very small bedroom,bear,420650
what are pots cooking with a plaque surrounding it,oven,287025
what cut in half laid across a table,oranges,311326
"what is the center of a room with blue carpet , striped chairs , and wooden tables",fireplace,14628
what does an architectural clock tower illuminate,sky,535891
"what sit in bushels , waiting for customers to buy them",apples,393297
what is in this bathroom there next to the toilet,chair,140821
what are there going down the street,buses,551197
what affixed to the stone building,clock,383580
what filled with lots of metallic airplanes,airport,406981
two women eating what on a terrace above a green valley,meal,54194
what show two girls in old fashioned bathing suits,picture,545806
what features sausage and eggs as the main diush,tray,74624
what did the group of people on skis at the top of a snow cover,mountain,515181
what is parked on the side of the street,bus,191072
the young boy riding what down a snow covered slope,skis,268129
what sniffs the head of another zebra,zebra,436941
what parked with the truck next to it,jet,496933
what filled with water and flowers,vase,258265
what are there laying on the counter,toothbrushes,57249
what is on the floor next to a jacket,suitcase,267880
what lays on it 's side on the beach,boat,215806
what is the woman with glasses holding,camera,423850
what are three people carrying through the snow,skis,456639
"what do old style military olive coming in for a landing , wheels down",airplane,401270
what stands next to the person in red pants near a tiny fenced area,cow,571929
what is being displayed on a grassy area,truck,23797
what sit on the railing of the deck near the pier,birds,104725
the man wearing what with his hands raised,uniform,544796
what are standing with chains around their ankles,elephants,532439
what did the bride and groom cut,cake,483788
what does the girl throw to two boys on a beach,frisbee,380350
what is the man in a red shirt playing,frisbee,431393
what is carrying the men back to the land,boat,116834
what is parked on the street,bus,344578
what is growing the bright green,plant,558129
what does the baseball player swing at a pitch,bat,576518
what walk in green grass beside a tree,giraffes,302656
the man wearing what is riding a horse,hat,489476
what parked in front of a house,motorcycle,79481
the group of people sit at a table and hold what,phones,565771
what flew over the mountains in the ocean,birds,163546
what is standing on the desk beside the computer,cat,560088
what gather to eat food out of a metal bowl,dogs,111131
what is this carrying a full load,train,501661
pineapple what looking dish with sodas on the side,pizza,306758
what donut sitting on top of white paper,chocolate,207598
what are standing or walking near the fence,giraffes,17997
what is traveling down the track in the country,train,542559
what paw rests on a computer keyboard,cat,497320
adult riding what next to skiers on snow covered area,horse,457011
"what did the white dog stuff with red hat ,",toy,28373
what lifts off into the sky,airplane,419105
what is staring at itself in a mirror,dog,168020
what stopped at the stop light during the evening,cars,253480
what is walking through the large field,elephant,203166
what is the girl riding down the street while talking on her phone,bicycle,396853
what does the tennis player hit while playing a match,ball,225607
what does the cheesy dish include,ingredients,95097
what sits on the side walk,bench,183413
what is installed with the flusher on a back wall a couple feet above it,toilet,88376
what dressed with a tie around it 's neck,cat,301146
what scattered on the field grazing on some grass,horses,210591
what is shown with wood cabinets,bathroom,253464
what is next to an adult sheep on the grass,sheep,389154
what stands on the edge of a cliff by a body of water,seagull,23419
what is moving along and billowing steam,locomotive,84776
what does the scantily-clad woman hold to her ear,cellphone,413012
what is standing almost camouflaged in a field,zebra,215795
what filled with lots of different types of airplanes,airport,531309
what are two giraffes standing next to each other and one giraffe is eating from a female 's hand,grass,271280
what is kissing the poll in a good day,giraffe,169466
what is in the window,bird,267498
what walk in an open savanna with dried grass,elephants,137154
the boat holding what sits in water,vegetables,274130
"cheesy what with broccoli , tofu , and red bell peppers",dish,406543
what is taking off at the airport,airplane,249529
what stands near some tall trees,train,435041
what retrieves the frisbee in a pile of leaves,dog,170326
what drives along on the road,bus,288015
what is wearing the shirt with personalized writing,bear,88456
what filled with flowers sitting next to a window,vase,166711
"what is the vintage black and white photograph of individuals wearing , and carrying umbrellas crossing the street",hats,413929
what perches on one branch that is a series of branches,bird,185588
what sits in front of a building,bicycle,36548
what formally set with flatware and silver serving dishes,table,486415
what is laying in the open street,bull,406770
what standing by a closed door,bird,505122
what is looking into the distance,bear,267350
what a red sports car across a parking lot,truck,449469
the boy riding what is doing tricks,skateboard,87308
what are there sitting next to each other,fruits,265531
what is the cat resting on top of a suitcase and cleaning,paw,228861
"what hold two hot dogs with condiments , and a steak sandwich",containers,321
what sits on rust colored tracks,train,578376
what filled with scissors and some pens,cup,317464
what stopped at the railroad crossing with a train going by,car,492244
what do the jovial older couple and a young woman enjoy,meal,444010
what sit on the desk with papers and a computer mouse,computers,465825
what is white and red near the house,house,268642
"what topped with cheese , pepperoni , and olives",pizza,214955
what are cooking on the stove top,carrots,89735
what are on the plate next to two candles,bananas,161835
what is showing signs of being sick and malnourished,cow,42675
what plated neatly on the dish,vegetables,175116
what is parked beside the car on the street,motorcycle,256141
what are one third the size of the mountain range,buildings,362152
what are running in an open field with blue skies,zebras,476520
cops riding what through a busy city street with traffic,horses,45089
"what is the person walking on a dirt path with a horse beside them , and is carrying a pack on it 's back",horse,59351
what are lined up and parked on the lake,boats,249200
what are all standing around the fence together,giraffes,184862
what do mounted police ride down the street,horses,284667
what is flying through the ski,biplane,331738
what filled with sand next to the ocean,beach,99299
what topped with the sandwich and two salads,plate,431808
what are grouped next to the white teddy bear,bears,452783
what are many people on some grass and some flying,kites,435889
what is sitting next to a window in a bathroom,tub,322615
what filled with people and plants,car,389159
what are standing next to each other,giraffes,362062
what is there seen here in the wild,zebra,82202
what is laying on a train track in a road,bicycle,203765
what does look like the castle with an unusual clock,device,184661
what topped with three computer monitors,desk,279777
what is the cat laying on the window sill sniffs,bottle,162206
what did the multicolored stuff with a tag on it 's ear,bear,194538
what is laying on it 's back,bear,328295
what is on the large plate,meal,36966
what does the dog watch watching the tv,dog,549236
what did the man in a suit tip,hat,473464
what is sleeping on the desk in the sunlight,cat,404350
what are sitting on a trailer outside,bicycles,379064
what are on the path leading to a lighthouse,bicycles,334997
the man riding what down a snow covered slope,skis,392750
what leans on the bench in a park,bicycle,565401
what is shown with outdated electronics,desk,369126
"what is visible , with the television seen in the mirror reflection",bed,505713
what carries the women in a sled,horse,102118
what are the man and a child flying together near a small pond,kite,514193
there is a woman walking what down the street,dog,283138
what stands on the window child blocker,bird,398757
what parked in the parking lot,buses,360575
what sits on top of a wooden desk,computer,289912
what is in the air with a flag painted on it,airplane,299050
what is the woman carrying by herself,surfboard,166297
what is holding a flower sits on a desk,bear,451400
what are there flying together in formation,jets,179085
what gathered around an object in a field,birds,324104
what next to a zebra near a roller coaster,giraffe,228074
what is decorated for someone 55th birthday,cake,550239
what did the meat fill sitting on a pan on a table,pizza,237003
what are there wading in a small body of water,zebras,555976
what is the woman with a crazed expression stabbing with a knife,cake,43692
what are some people flying in a field and clouds,kite,409681
what sits on top of a sign with a baseball team name on it,clock,511651
what is the man hitting with a racket,ball,352515
what monitors on the bench two powered on,computer,118550
what are walking on the beach in the distance,horses,422307
what sits on the antique plate,sandwich,213652
what is forced to do tricks for the guy at the circus,elephant,470995
what parked outside in the lot,truck,331793
what filled with lots of office equipment and windows,room,232717
what are there flying through the sky,airplanes,90106
what piled on luggage carts at an airport,suitcases,539174
what is there next to a dryer and washer machine,refrigerator,132972
what walk near the giraffe that eats from a tree,zebra,287360
what is designed to take many twists and turns,rail,361246
what is seen on the runway,jet,191785
what passes the blue truck parked on the side of the road,bus,361208
what is the man jumping off some stairs,skateboard,119118
what is the man wearing glasses eating,donut,322212
what parked on the street with buildings in the background,motorcycle,476791
the man holding what walks past a parked motorcycle,toy,155894
what is walking alone in the sun,elephant,553189
what is smiling with egg and greens in room,plate,72118
what topped with the pizza being cut with a spoon,plate,295193
"what is there here , and the system said i had to type at least eight words to move on",picture,238822
what are walking around in the tall grass,cows,161499
what is driving down the hill,truck,498615
what sits on the branches of a tree,bird,129719
what is standing near four sheep,calf,248604
what are several donuts on a fluted serving with icing dripping off,dish,475236
what are laying next to the loaf of bread on a cooling rack,bananas,579917
the tennis player wearing what prepares for a serve,shirt,461286
what are standing in the tall grass,cows,579787
what is parked on the runway,jet,144561
what show the pig eating in a trough and a sheep eating grass,pictures,477639
the group of people are skiing down a snow covered what,hill,488243
what are the herd of cattle crossing,beach,576996
what split into seats at a grassy park,benches,357771
what looks intently at the macbook pro being unboxed,cat,27706
what is riding down the tracks under a bridge,train,427348
what is the cow standing and staring straight ahead,trees,377576
what does the photo of someone 's living during christmas time,room,337902
the building filled with rusted merry go what laying on the floor,horses,30725
what next to the clock on a sidewalk in front of a store,bicycles,340471
what shows the small bathroom space with a toilet and a shower while a sink sits near the open door,door,491128
what is dated back to 1933,knife,569656
the baseball player holding what is standing on a field,bat,126521
what stands over the body of a dead squirrel on a paved road,bear,330243
what parked along the road with a truck driving by,motorcycle,94416
what is sitting next to the keyboard,mouse,91113
what are people riding down the street inside,horses,334758
what is traveling through the train station,train,97255
what resting on the rock atop a mountain,backpack,217108
what is the man wearing sitting down,tie,460857
what lie beside the bottle of wine in straw,glasses,391065
what is the man wearing a bright red shirt gets taken by a lady in a bright pink shirt,picture,377473
what is lying underneath the blanket,kitten,162031
what are packed next to the building,vehicles,558508
what is riding down the rail road tracks,train,98543
"cilantro , what , and jalapeno on a bun roll",carrots,464456
