question,answer,id
what are looking for food in the field,dogs,260741
what is the man holding game steering,wheel,319662
what looks in from an open window with his paws on the windowsill,dog,381887
what parked near one another,buses,255214
what are some people riding on the railroad on a sunny day,train,295565
what is the man swinging on the diamond,bat,92428
what sit in the bowl and on a dining table,oranges,461561
what stands on the concrete next to pieces of plywood,motorcycle,473014
construction what parked in line on a dirt road,trucks,362333
what cut in half with pickles on a white plate,sandwich,98642
what next to modern office building,clock,200759
what lined with lots of wooden stools,counter,213288
what is the woman taking on a staircase,photograph,120676
what topped with bacon sitting on a table,pizza,44616
what are on wax paper in front of a child,donuts,59165
what does he adjust to the right to correct his position,skis,68149
what are two children brushing 'm,bathroom,407634
the girl flying what designed kite in the sky by the ocean,bird,304939
what shows the dog and a half donut,picture,129806
what filled with the carrot salad,bowl,324450
what does the young girl fly with a bunch of people in the background,kite,53712
what lit up on the cluttered desk,lamp,554502
what are standing next to each other while tied to a string,cows,374956
what is cramped with the bed and desk and other items,bedroom,333807
what are being cut into pieces on a kitchen counter,bananas,425201
what are several cows grazing in a field along side,road,162226
what is standing on the beach and looking at the camera,cow,529050
the red suitcase and a green bag next to a wall with spray painted what,graffiti,469531
the man riding what down a snow covered slope,skis,457774
what is sitting at the terminal,airplane,107838
beautiful and clean what with granite sink and painted walls,bathroom,48223
what is the man riding skis down the snow covered,hillside,390120
what tiled with tan marble,restroom,54171
"what holds the cup of mcdonald 's coffee , a cold drink and two fast food breakfast entrees with sausage , egg and muffin ingredients",tray,227675
what is enjoying his time on the couch,puppy,482392
what is flying through the sky,airplane,543683
what is sitting with the pair of shoes,bear,268190
what towering over the city,tower,417194
what did the blood soak sitting next to a nazi helmet on a white table,bat,455879
the man riding what down a snow covered slope,snowboard,265646
what painted over an arrow sign,graffiti,225557
what do the pair of elephants stand and eat,vegetables,127710
what does the cat watch through a window,bird,370808
what is the convenient means of land transportation when you live on a boat,bicycle,570574
what is the woman frosting while holding a baby,cake,480908
what shows the dog looking out the window,mirror,573744
what is the little girl standing and holding game,device,306905
what is the dog looking out,window,252627
the cat is sitting behind a glass and barred what,window,371789
what are parked in the lot at the bus station,buses,517089
what sits perched on the tree branch,owl,299717
what staning while is looking at the camera,zebra,296225
what sits on the plate next to a cup of coffee,cake,68749
what does the man hold,surfboard,67566
what are standing behind their fence at the zoo,giraffes,142287
"what cluttered with many items , including a tea kettle , a pot , a food scale and more",counter,65484
what is standing outside in the field,giraffe,177530
what are shown on the table,pizzas,104541
what is sitting across from another plane with its propellers spinning,airplane,144084
the stop sign and street signs share what,pole,510997
what are standing in the water looking for food,birds,560580
"what are the young boy , and an infant boy holding",frisbee,574957
what filled with meat on top of a plate,sandwich,570518
"what is standing , looking into the store windown",dog,468049
what is on the runways letting passengers off,airplane,313807
what is turning the corner,bus,523224
what is staring ahead while standing in the grass field,zebra,259477
what stands on the edge of a bed looking at television,cat,182098
what does the lone surfer carry on a beach,surfboard,521602
what stretched out asleep on the child 's bed,cat,580620
the car gingerly walks around what,bench,110155
what are sitting on a runway in the snow,airplanes,466522
what are standing together surrounded by trees and shrubbery,giraffes,359189
what sleeps in the leather shoe,kitten,518015
what topped with bread and eggs,plate,138385
the road lined with giant white vases surround what,garden,471156
what lay next to each other on the white tile,dogs,437173
what filled with lots of different drinks,refrigerator,184763
what are sitting on the outside of a bus,dogs,293289
what are sitting empty under an awning,cars,224812
what filled with purple flowers on a table,vase,153016
what closed off from the car accident,road,2687
what does the young woman sell at a stand surrounded by other fruit stands,bananas,415283
what does holding glass as they sit at a table looking at some paper work,wine,449414
what is there standing in a pool of water,zebra,240414
what is hanging from a ceiling,airplane,1168
the woman assists a young man wearing what with tying a red tie,shirt,102281
the cute small dog wearing what,hat,235740
what is next to the laptop computer,monkey,203248
what is taped up and sitting in storage,fridge,153907
what is sitting on a cutting board,cake,485234
what parked at the street stop,bus,509217
tow what parked in front of a metro shop,truck,221243
what does the man open,refrigerator,397148
what perched on top of barbed wire,bird,579621
what is two people holding,umbrella,16069
what is going down the street and in the background is a fence and a tree and a brown house,bus,16513
what is behind the building in san francisco,clock,57731
what are in the box on a table,dogs,192710
two people near each other holding what,bowl,579138
what are sitting on a plate with a drink,sandwiches,284008
what does the boy in a baseball uniform and helmet hold,bat,247866
the man riding what on top of a snow covered ground,skis,505128
what does the man in a blue t-shirt feed,giraffe,501936
what rests on the pavement while another stands watch,bird,198406
what is driving along the street,bus,411243
what is chirping with sitting on the branch,bird,333916
what are walking away from each other against a fence,giraffes,27829
what filled with gallons of milk and orange juice,refrigerator,330607
what is shown with the large circular mirror,bathroom,385426
what are passing the narrow street filled with signs,cars,3493
what are there parked on the street by a sidewalk,cars,175951
what is the statue of the man wearing a suit and red tie and carrying,umbrella,460344
what parked in front of a building beside boxes,bicycle,241935
what does the very vibrant and detailed angry birds theme,cake,474759
what was both blue in color,bicycles,478132
"what the streets in front of a barber shop in the town of wayland , michigan",cars,365041
what are standing near a stone wall looking beyond,giraffes,445768
what rests in the light cast by a television screen,cat,321736
what is the woman holding with the keyboard and monitor detached,laptop,538574
what is sitting on the plate near some glasses,sandwich,37394
what is placed in the yard as a planter,toilet,24450
what is headed for its destination,bus,122902
the small dog sits on a cushion and looks out what,window,200376
what ; one dressed as a female and one male,bears,345701
"what stands majestically , blending in to the savanna",giraffe,528116
the close up view of someone 's hand holding what,phone,388070
what sit on plates next to a flask of tea,apples,306080
what moored at the pier on a lake surrounded by mountains,boats,2623
what is going down the large river,boat,475370
what is at the end of a stretch of water,tower,185826
what is moving along train tracks,locomotive,72993
what sits on top of the hill,house,202545
what is the giraffe tongue reaching out leaves off,tree,425041
what are an old man and a young boy playing,frisbee,434986
what is there sitting on a wood surface,frisbee,312662
what do the diet book and some fruit kn sitting on the counter,plate,415222
what sits in an empty parking lot,motorcycle,76014
pre what next to bananas that look brown,apples,138507
colorful blue and red vase depicting what,bird,478195
what navigate through the busy traffic of the city road,cars,300414
what is sitting on a stove,pot,274999
"what did bedroom , king size in light brown tone bed cover , small table for writing , probably hotel room",bed,528782
what is about to take off from the field,helicopter,414754
what flies high over snow capped mountains,airplane,296059
what is flying across the sky,airplane,341916
"what racer , making the tight turn rounding a corner",bicycle,323125
what walks among grass and rocky terrain,bear,528882
what is flying through a blue sky,airplane,81406
what walks around his zoo exhibit,bear,405718
what did an unpainted wooded with two signs on it and a small fire hydrant,fence,400860
what sits inside of an outside kitchen,floor,551986
what is driving down the train tracks outside,train,218862
what is parked near the tables,truck,411603
"the parked red , white , and travel what",bus,78087
what are there eating from one tree,giraffes,130967
what is topped with avocado and cilantro,pizza,567914
what drives down the track surrounded by hills and trees,train,231060
the woman wears what and carries an umbrella,sunglasses,440340
what parked next to each other on tracks,trains,422869
what are the baseball players holding,bats,180555
what stands next to the small kitten,dog,571076
what are parked in front of a garage,vehicles,404183
what is parked near other cars in an alleyway,truck,416901
what display in the clothing store,window,362764
what about to cut the british pound note,scissors,282900
what partially buried by the dirt,hydrant,457651
what seated at the green table in a small kitchen,sculpture,242261
what are there next to each other with chairs in them,boats,530403
what is the boat traveling past an island n,ocean,331085
what is set on the table,vase,399220
what does the man is skiing on with shades on,mountain,270534
what is posed to be directing behind the camera,bear,229440
what sits in the forest,hydrant,176098
what drawn carriage moving through the street of a small town,horse,196049
what pull the carriage with three men dressed in red on it,horses,163220
what does the batter throw after a hit in a baseball game,bat,400558
what stands on white sand looking at the ocean,seagull,418586
what is walking alone in the field with grass,elephant,5263
what is walking through the pond,bear,52044
what is next to the monitor with the same image on both,computer,292558
what are grazing in the field,sheep,343696
what stands in front of a line of trees,elephant,198977
what might get the shock this fence is electrified,elephant,409179
what is standing on the side of the road,cow,564643
what is sitting next to a kitchen with hard wood floors,table,176174
what is leaning against the trunk of a tree,bear,7936
what protrudes from the corner of a brick building,clock,407091
what is near some tall trees,garden,353412
man holding what want another man ties down,towel,184610
the person holding what up to their face while sitting in a car,phone,236661
there is a brown and white horse eating what on a field,grass,551597
what is the skater in the black and white photo performing,rail,52112
what is decorated with words and objects,cake,245733
what are young women playing on the grass,frisbee,276671
what filled with food to eat,containers,573337
what sits in the center of a desk in an empty room overlooking a residential landscape,computer,500077
what shows the very colorful bus behind this vehicle,mirror,479949
what did the stop sign on a corner with water and snow cover in the distance,mountains,154648
"what shows the white toilet , white bathtub and a silver sink",bathroom,341534
what does the person fly on the bridge,kite,183015
what perched on top of a green bush,bird,463984
what is by the water,hydrant,568947
what is driving along down the street lined with trees,bus,360397
the man using what looks on,blender,182367
what is the man returning while playing tennis,ball,412931
what is sitting on top of a grass covered field,car,163897
what are laying on a bed with a patterned comforter,dogs,457214
what are being displayed on top of a lap top,phones,320125
what is on the frying pan,sandwich,42519
what are standing out in the field,zebras,186045
what parked in grassy area next to a picnic table,motorcycle,163114
someone holding a single glazed krispy what,donut,36413
what stand next to the chain linked fence,giraffe,226961
what is parked next to the red motorcycle,motorcycle,348436
what stands with the cross on the roof top,building,335925
what are being flown above the water at a river or lake,kites,343183
what topped with the cut in half sandwich with chips and salad,plate,466242
what decorated with decals rides down the road,trolley,199534
what is driving down a city street,bus,530433
what are driving by each other going different ways,buses,484620
what is flying high,kite,161545
what are traveling on a highway with kites in the sky,cars,490328
what is parked outside the building getting an electrical charge,car,59384
what walks in the foreground while a bison looks on,bird,334046
what parked at an airport with a food service truck in front,plant,300011
what looks old and rusty on the sidewalk,hydrant,368768
what did the woman standing on top of a grass cover,hillside,366005
what is filled with different types of kites,sky,318657
what a wall behind a cobblestone path,benches,220139
what walks in front of an adult giraffe,giraffe,536579
what is rolling down the tracks,train,81556
what are travelling on the bridge over the water,trains,138067
what looks off into the distance at the light,cat,73260
what sliced in four pieces and a beverage in a glass on a table,pizza,250293
what sits perched on the tree branch,eagle,104051
what does the bathroom feature along with a sink,bathtub,48892
what filled with lots of leafy green plants,garden,172366
what topped with different types of foods,plate,251988
what is parked on the street,truck,458876
what proceed single file down a street in procession,trucks,557183
what shaped like two animal characters,cake,416054
what are on the tea saucer,donuts,285397
what are some of the smallest ever seen,scissors,385684
what look like they could be twins,giraffes,207065
"what features the white bedspread , chandelier , lamps , case , animal print pillows , and there is a door open to another room",bedroom,538547
what is the baggage handler loading onto a plane,luggage,199432
smiling people enjoying what together,meal,122147
recreational what beneath an umbrella on a beach,furniture,308349
what is racing down train tracks,train,464555
what do the man cross on a trail surrounded by trees,skis,8468
what is floating in a lake next to massive snow covered mountains,boat,288642
what is done in colors of black and red,room,217725
what is flying with its wheels down,airplane,194862
multiple what hanging from ropes next to a rock,bears,473972
what does the stuff bear is on,chair,554341
"what graze in the field beyond a barbed wire fence ,",cows,472455
what is the skater using,skateboard,335395
what is someone holding up,banana,267956
what loaded with the bunch of toppings and wrapped in foil,dogs,411257
what are lying on someone 's dirty unmade bed,cats,539008
what is stretching its neck up into a tree,giraffe,41802
what are galloping around their enclosed dirt turf,horses,343558
what casts the shadow on four chairs on a beach,umbrella,229058
what is held under the faucet,toothbrush,468214
what is going down the road,bus,560997
what are the man and small dog riding down the street,bicycle,325042
"what are there turned on , on the desk",laptops,129821
what seem to be sharing something together,birds,496831
the man riding what down the side of a snow covered slope,snowboard,214888
what is the black man sitting on,sofa,270024
what did the statue with two pools and a clock tower on a tree line,sidewalk,434072
what drives down the road,bus,548824
what is leaning next to the pole outside,bicycle,298182
what are the animals eating outside,grass,385130
what are staring outside through a window,cats,271249
what hangs on the barbed wire,bird,259658
what carries the red frisbee on a field,dog,91275
what are by the water and there are a bunch of horses in the distance on a grassy field,horses,209851
what is the male skateboarder skating up,wall,454359
what is on exhibit at the museum,airplane,154068
what do two people hold at a restaurant,glasses,131315
what are two children carrying and walking along,umbrellas,21070
what are walking through the street during traffic,goats,116398
what does the woman set up beside a fire hydrant to paint a masterpiece,shop,289621
what are coming through an intersection where there are stop lights,cars,16113
what is on by the laptop on a desk,lamp,84284
what is young man holding a baseball glove and wearing,cap,451703
what placed next to soft drink container,machine,467262
what are in the shape of a heart in the frying pan,vegetables,222276
what sliced in half with a bowl of cereal and a spoon,sandwich,76877
what are flying in the sky over the water,kites,377297
what is sitting in a living room,tv,577725
what is in the small bathroom,toilet,129894
what parked by the construction site,trailer,525248
what is sitting on the side of the road,car,206622
what are out in the sky with trails behind them,airplanes,60953
what led by the man through a street next to a building,pony,388772
what is the man walking on the beach carries,surfboard,430175
what lie next to the boat in the sand,cows,140500
what are used to open an ipod package,scissors,218625
what sits atop the tiled black and white floor,toilet,354600
what did the woman placing open on tables in a room,umbrellas,315168
what does the man on his lunch is eating,sandwich,290398
what is shown on the tray with a side of cole slaw,sandwich,122097
what are grazing in the lush field of grass,sheep,542674
what did the cow standing on top of a grass cover,hill,268603
what is on the runway,airplane,404877
what topped with daisies made from icing,cake,490247
what is driving on the train tracks,train,41843
what is sitting in the middle of a bathroom,tub,228442
what does the man with blue shorts and a green t-shirt and blue suspenders and holds,frisbee,519510
what did a carve up sitting on a table,cake,215847
what is the woman in white wearing outside,skies,373509
what is the man holding,banana,31653
what sits at an airport,jet,141494
what do the parking meter pay on an empty street with no cars or people,station,162596
what of dishes and the floor is old,sink,307502
the fire hydrant out side what,outside,291683
fishing what docked on a busy shore,boat,534189
what are three people sitting at a table in a brightly lit,restaurant,218832
what are three snow skiers holding on their shoulders,skis,154373
what is the man using on a city street,booth,326320
what does the woman in a camping chair use,laptop,27041
what parked by some vehicles,airplane,492882
what sit on the plate with other fruit,bananas,230152
what is travelling down the tracks,train,224260
the young woman in a coat holding what,laptop,333643
what is spotlessly clean,kitchen,417276
two girls holding what in a field of wildflowers,umbrellas,262012
the man riding what down a snow covered ski slope,skis,8968
what filled with pink and green flowers on a table,vase,147716
what is eating a snack,cats,223932
the male tennis player wearing what is playing tennis,shirt,130007
what is laying on the floor resting it 's head on a shoe,cat,381875
four people standing on a lawn holding what,surfboard,149996
two women flying what in a field of long grass,kite,136493
what is there walking through the woods,bear,70794
what does the guy in a yellow shirt catch,frisbee,461281
what parked on the side of the road,car,203711
what is the man wearinga and cutting a cake,hat,400377
what are standing on the grassy field,sheep,325346
what appear to be kissing and in love,elephants,30065
two people enjoying what at a restaurant,pizzas,464598
what filled with different types of asian businesses,building,269372
what is hiding under the blue blanket,kitten,454996
what topped with different types of donuts,dish,490385
the dog wearing what looks in a mirror,suit,168020
what is the person holding with a doughnut in it,bowl,354936
what is sliced in half and placed on a bun,dog,27534
what covered in cheese and broccoli on a blue plate,pizza,305517
what are wearing harnesses and red caps,horses,281595
what is the young man swing,bat,236186
what are standing watching two lions walking away,zebras,119938
what is this turning a street corner,bus,222703
what parked across from the building on a busy city street,cars,503378
what parked next to each other,buses,52693
the person holding what walks by a dog on the sidewalk,umbrella,45785
what is the person snowboarding down a snow covered,hill,299585
there is a very long yellow train coming up what,tracks,351537
what holding a sandwich with fruit and vegetables plus cookies,container,510027
what holds many items and is next to a file cabinet,cabinet,251700
the tattooed woman in a bikini holding what,surfboard,161814
the woman in black jacket holding what,cellphone,335357
what is sitting on the knees of someone in a chair,laptop,269045
what stands apart from the black and white photo of people standing in front of a statue,umbrella,146954
what makes its way through the middle of the city,truck,420634
what is clean and ready for guests to use,room,499147
two men vigorously compete over what,ball,190732
the couple of white horses walking along side what,hillside,516071
what is stuck into the sand at the beach,umbrella,48733
what are walking through a flower and grass covered park,bears,564920
what walks in front of a building,bear,74032
what roam through the grassy area,bears,156216
what is sitting next to a truck on a runway,jet,53111
park what to the field in winter,bench,33787
what is living displayed in front of a window,furniture,577225
what is looking at her cell phone,shirt,175541
what is sitting on the red leather chair,cat,74825
what is perched on the tree limb outside,bird,379317
what is pulling the car on a highway,truck,160910
an older couple cutting what together,cake,361394
what set beside the christmas tree,bear,290889
the professional camera and light facing what,oven,348871
what is covered in stickers on it,refrigerator,237954
what is standing near the beach,box,324246
what parked next to the sidewalk on the street,motorcycle,490887
the person on a silver three wheeled what,motorcycle,349472
what is there left of this pizza,slice,157204
what decides to take advantage of a pause,horse,441407
what is walking behind the person,dog,255706
what sits on the parked motor bike,dog,2337
what lies on the plate containing half of a chocolate cake,knife,306047
what are the friends all eating at the table in the restaurant,dinner,57217
what is lying on a field with grass,frisbee,7778
what sleep together inside the pet bed,cats,445731
the young boy wearing what poses with a glove,uniform,431824
what is next to the street,hydrant,115422
the man riding what on top of snow covered ground,skis,340136
what next to the road with a yellow suv is driving on it,horse,170035
what is riding through some waters,boat,355321
what is standing on the grassy ledge with mountains behind it,horse,485082
what do the very modern office break with a kitchenette,room,451033
what covered in toppings on top of a container,dog,171444
what sits on the table in front of a couch,tv,416047
what sits on the branch in a tree,bird,521881
what is laying down alone in the room,cat,233970
what topped with toasted bread and fries,plate,280758
what stopped at the train station with empty platforms,trains,519165
what is standing on the logs,bear,3398
what is made with matching pillows and a blanket,bed,29090
what is on the plate with beans,sandwich,186247
"what packed with mac and cheese , vegetables and a treat",box,460408
what walk next to each other on rocky ground,cattle,566592
what parked next to the double decker bus,truck,335109
what is the person flying while standing in the water of a beach,kite,202806
what is holding the meat with a side of cooked vegetables,dish,473608
what is the man trying with his chosen shirt,tie,448671
what hangs open above the bidet in a bathroom,window,352233
what colored like flags of countries in some type of gallery,boards,153142
what is sitting outside the display window of a clothing shop,motorcycle,259766
what do pasta and various vegetables cover,plate,416776
what is clean and empty of people,room,238177
what filled with lots of flowers near a window,vase,20213
what is sitting on top of a dry grass field,bus,20289
what is driving down the quiet road,car,396907
what sits in front of a shower with a glass slider,toilet,67405
what are sitting parked beside each other in front of buildings,buses,530132
what sits in the derby car under which another teddy bear is pinned,bear,357004
the man behind a fence swings what,bat,441850
what is the young man carrying,kites,7500
what move through an intersection below a green stoplight,cars,166126
what is the man using,computer,264244
what hung on the refrigerator by magnets,pictures,549517
what left out upside down in the dirt,umbrella,118762
what is very old and pieced together,fence,76627
what is the man on a tennis court holding,racquet,542090
what did an elephant paint,picture,571351
what is sitting under the tree in a park,bench,395469
what is sitting next to a software titled '' law & order special victims unit '',computer,397315
